{
  "iris": "1",
  "type": "report",
  "id": "doc-docs-project",
  "title": "Docs Project",
  "status": "draft",
  "agent": "other",
  "created": "2026-08-21T04:48:26.415Z",
  "updated": "2026-08-21T04:48:26.415Z",
  "commit": "0000000000000000000000000000000000000000",
  "tags": [
    "report",
    "adopted-doc"
  ],
  "sections": {
    "summary": [
      "Read-only mirror of docs/project.md",
      "Source: docs/project.md"
    ],
    "open_items": {
      "md": "# iris project constitution\n\n## Problem\n\nDevelopers using AI coding agents need fast, visual, versioned documentation that stays local and file-first.\n\n## Prime Directive\n\nMinimize prose and maximize meaningful visuals so humans understand a change in seconds.\n\n## What iris Is / Is Not\n\niris is an open-source local skill + CLI that manages and renders contract data into deterministic HTML.\n\nNon-goals (v1): no SaaS, no server, no auth, no telemetry, no MCP integration, no analysis engine, and no remote lifecycle engine.\n\n## Ecosystem Position\n\nOpenSpec is lifecycle truth, GitNexus is code truth, iris is the renderer for both.\n\n## Target Users\n\nDevelopers working with Claude Code, Copilot, and Codex.\n\n## Repo Layout iris Creates\n\n`iris/config.yaml`, `iris/state.json`, `iris/design/*`, `iris/project/*`, `iris/pages/*`, `iris/archive/*`, `iris/index.html`.\n\n## v1 Scope\n\nM0 foundation + M1 design system and dashboard, then typed templates, a deterministic local lifecycle layer, and distribution milestones. Lifecycle remains repository-local: no remote orchestration, hosted sync, or background service.\n\n## Glossary\n\n- page: one rendered HTML artifact for a contract id\n- contract: JSON data envelope + type schema\n- block: typed visual unit (text, chart, flow, code, etc.)\n- section slot: fixed location in a type template\n- shim: generated agent-surface integration file\n- mirror: read-only rendered copy of existing markdown docs\n- stale: dashboard/page flag when scoped files changed since last render\n"
    },
    "promotable_as": []
  }
}
