{
  "iris": "1",
  "type": "report",
  "id": "doc-docs-status",
  "title": "Docs Status",
  "status": "draft",
  "agent": "other",
  "created": "2026-08-21T04:48:26.415Z",
  "updated": "2026-08-21T04:48:26.415Z",
  "commit": "0000000000000000000000000000000000000000",
  "tags": [
    "report",
    "adopted-doc"
  ],
  "sections": {
    "summary": [
      "Read-only mirror of docs/status.md",
      "Source: docs/status.md"
    ],
    "open_items": {
      "md": "# iris status report\n\n> Snapshot date: 2026-08-21 · branch `main` · read-only audit, no code changed.\n\n## One-line summary\n\niris is a working 0.1 CLI (14 of 16 documented commands implemented, 10 test suites, 7-gate CI) with **4 open spec tasks, 2 stub commands, and 7 backlog items** — but an entire milestone of work (35 files, +2,911/−803) is sitting staged and uncommitted on `main`, and the npm package is not yet published.\n\n## What iris is (for anyone landing here cold)\n\nA plain Node.js CLI — no server, no AI runtime, no telemetry. You (or an AI coding agent) run `iris` commands in any repository; it writes JSON contracts under `iris/pages/<id>/data.json`, validates them against `schemas/`, and renders deterministic static HTML that opens straight from disk (`iris open`). It is **not** an agent-only skill: agents are one of its users, not a requirement. The Claude `/iris *` / Copilot / Codex \"skills\" mentioned in docs are planned thin wrappers around this same CLI (later milestone; see README \"How it runs\").\n\n## Implementation state\n\n| Area | State |\n| --- | --- |\n| Commands implemented | `init`, `render`, `report` (incl. `--from-session`), `publish`, `feature`, `bug`, `idea`, `plan`, `sync`, `adopt`, `archive`, `export` (`--single` only), `open`, `update` |\n| Commands stubbed (exit 1) | `promote`, `vendor` |\n| Export modes missing | `--png`, `--pdf` (blocked on approving a browser renderer) |\n| Tests | 10 vitest suites in `tests/` |\n| CI gates | lint, token-lint, typecheck, test, html-check, smoke:install (plus frozen-lockfile install) |\n| Runtime deps | `ajv` only — zero front-end framework |\n| Source size | ~2,600 lines of TypeScript in `src/` |\n| Distribution | `@dgtalbug/iris` 0.1.0, **not yet on the public npm registry**; Homebrew deferred until a release URL + checksum exist |\n\n## Pending work\n\n### Open spec tasks — 4 of 48 unchecked\n\nActive changes live in `openspec/changes/` (archive holds completed ones).\n\n| Change | Done | Open tasks |\n| --- | --- | --- |\n| brew-formula-and-installability | 6/9 | 1.1 decide primary install story · 1.3 confirm formula matches local-first goals · 2.1 add release packaging/formula |\n| standalone-publish-and-export | 11/12 | 2.2 implement PNG/PDF export modes |\n| project-lifecycle-automation | 15/15 | none — complete, ready to archive |\n| session-ingestion-and-reporting | 15/15 | none — complete, ready to archive |\n\n### Backlog (`BACKLOG.md`, unscheduled)\n\nVS Code webview extension · `iris publish` to gist · session-storage report ingestion · Reaviz swap behind chart contract · MCP wrapper · brew formula · themes marketplace.\n\n### Not yet implemented but documented\n\n`promote`, `vendor`, full `--json` output parity, generated agent-surface shims (Claude/Copilot/Codex), permalink algorithm (M2/M3).\n\n## Risks and repo hygiene findings\n\n1. **35 files staged but uncommitted on `main`** (+2,911/−803): the lifecycle, session-ingestion, publish/export, and html-check milestones exist only in the git index. One hard reset loses them. Highest-priority action: commit (ideally on a feature branch + PR, matching how PR #1 was done).\n2. **Spec traceability is not versioned**: `.gitignore` excludes `openspec/*`, `.claude/*`, `.agents/*`, `.github/prompts/*`, `.github/skills/*`. Task history and decisions can't be recovered from a fresh clone, and CI can't see them.\n3. **Direct-to-main history**: recent commits landed on `main` without PRs; no branch protection evident.\n4. **Two Dependabot branches open** (`ajv` 8.18.0, `vitest` 3.2.6) awaiting merge decisions.\n5. **Dogfood dashboard is empty**: `iris/state.json` has no pages, so the shipped `iris/index.html` shows the empty state — the repo does not yet demonstrate its own product.\n6. **No LICENSE file** in the repo root despite `\"license\": \"MIT\"` in package.json; no CONTRIBUTING, CODEOWNERS, SECURITY, or PR/issue templates.\n\n## Enterprise-readiness checklist\n\nCurrent gaps against common professional/enterprise repo standards:\n\n- [ ] LICENSE file (MIT text) at repo root\n- [ ] CONTRIBUTING.md (setup, test, PR expectations — Quickstart exists in README, move/expand)\n- [ ] CODEOWNERS + branch protection on `main` (require PR, passing CI, review)\n- [ ] PR + issue templates\n- [ ] SECURITY.md with a disclosure contact\n- [ ] Conventional commits enforced (commitlint) → automated changelog + release (changesets or release-please) → npm publish with provenance\n- [ ] CHANGELOG.md\n- [ ] Version openspec/ history (or export decisions into docs/) so traceability survives a clone\n- [x] CI with lint/typecheck/tests/smoke (already strong: 7 gates including generated-HTML link integrity)\n- [x] Dependabot enabled\n- [x] Strict TypeScript, pinned toolchain, frozen lockfile\n\n## Suggested next moves (in order)\n\n1. Commit the staged milestone work via a PR; archive the two completed openspec changes.\n2. Publish 0.1.0 to npm (the smoke:install gate already verifies the artifact) so `npx @dgtalbug/iris init` works anywhere — this is the whole \"newbie in any repo\" promise.\n3. Add the enterprise hygiene files above (one small PR).\n4. Dogfood: render this repo's own overview/HLD pages so `iris/index.html` demonstrates the product.\n5. UI overhaul per `docs/design-system.md` (market research + full redesign direction, written alongside this report).\n"
    },
    "promotable_as": []
  }
}
