{
  "iris": "1",
  "type": "report",
  "id": "doc-docs-cmds",
  "title": "Docs Cmds",
  "status": "draft",
  "agent": "other",
  "created": "2026-08-21T04:48:26.413Z",
  "updated": "2026-08-21T04:49:43.915Z",
  "commit": "0000000000000000000000000000000000000000",
  "tags": [
    "report",
    "adopted-doc"
  ],
  "sections": {
    "summary": [
      "Read-only mirror of docs/cmds.md",
      "Source: docs/cmds.md"
    ],
    "open_items": {
      "md": "# iris commands and skills\n\n> If a command is not listed here, it does not exist.\n\n## Common\n\n- Exit codes: `0` ok · `1` validation/user error · `2` environment error.\n- Machine mode: all commands support `--json` (planned for full output parity in later milestones).\n- Agent surfaces: CLI `iris`, Claude `/iris *`, Copilot prompts, Codex `$iris-*` (generated in later milestones).\n- Navigation contract: the dashboard links every rendered, archived, and project page; every page links back to the dashboard. Contributors can verify all generated references with `pnpm html-check` (also enforced in CI).\n- Dashboard contract: briefing hero → health strip → architecture placeholder → work surface → project-docs strip. `/` focuses the work filter, `t` toggles theme, and arrow keys move between focused work cards; all remain classic-script, `file://`-safe interactions.\n\n## `iris init`\n\n- Synopsis: scaffold `iris/`, detect OpenSpec and GitNexus, create dashboard and editor task.\n- Flags: `--json`.\n- Inputs: current project directory.\n- Outputs: scaffolded `iris/` tree, styled placeholder project pages, `.vscode/tasks.json`, quickstart lines.\n- Exit codes: 0/1/2.\n- Example: `iris init`.\n- Surfaces: CLI + all generated skills.\n\n## `iris render [<id>|--all]`\n\n- Synopsis: render contract data to page HTML and refresh dashboard/feed.\n- Flags: `--all`, `--json`.\n- Inputs: `iris/pages/<id>/data.json` or all pages.\n- Outputs: `page.html` artifacts and updated `iris/index.html`; each page is linked from the dashboard and links back to it.\n- Exit codes: 0/1/2.\n- Example: `iris render --all`.\n- Surfaces: CLI + all generated skills.\n\n## `iris report|feature|bug|idea|plan <id>`\n\n- Synopsis: create type-specific draft contract skeleton.\n- Flags: `--json`.\n- Inputs: page id.\n- Outputs: `iris/pages/<id>/data.json` skeleton.\n- Exit codes: 0/1/2.\n- Example: `iris bug bug-cache-stampede`.\n- Surfaces: CLI + `/iris bug` style skills.\n\n## `iris report --from-session <path> [<id>]`\n\n- Synopsis: turn local agent session data into a report contract, render it, and keep the output in the page registry.\n- Flags: `--from-session`, `--json`.\n- Inputs: a JSON object/array export, a non-empty Markdown/TXT dump, or a directory containing named session artifacts. Directory discovery reads files whose names identify metadata, sessions, conversations, turns/messages, checkpoints, tool/file activity, events, references, summaries, notes, or reports; unrelated files are ignored.\n- Outputs: `iris/pages/<id>/data.json` plus rendered HTML for the report page.\n- Exit codes: 0/1/2.\n- Example: `iris report --from-session ./agent-session session-review`.\n- Surfaces: CLI + local session ingestion workflows.\n\n### Session import contract\n\nThe adapter is local-only and performs no network requests. It recognizes common camelCase and snake_case fields for workstream/title, branch, repository, status, timestamps, changed files, references, checkpoints, turns/messages, and tool activity. Missing optional metadata is represented as `null`, `unknown`, or an empty list rather than guessed.\n\nThe normal report fields remain available in `sections.summary`, `sections.open_items`, and `sections.promotable_as`. Traceable source data is also preserved under `sections.session_evidence`:\n\n```json\n{\n  \"source\": \"agent-session\",\n  \"input_shape\": \"directory\",\n  \"workstream\": \"Session ingestion\",\n  \"status\": \"completed\",\n  \"repo\": \"dgtalbug/iris\",\n  \"branch\": \"feat/session-report\",\n  \"timestamps\": [\"2026-08-18T08:00:00.000Z\"],\n  \"files_touched\": [\"src/commands/report.ts\"],\n  \"references\": [\"https://github.com/dgtalbug/iris/pull/42\"],\n  \"checkpoints\": [\"Parser verified\"],\n  \"tool_activity\": [\"pnpm test\"]\n}\n```\n\nEmpty files, malformed JSON, unsupported extensions, missing sources, directories without recognized session artifacts, and sources with no reportable evidence fail with an actionable exit-code-1 validation error.\n\n## `iris publish [<id>] [--output path]`\n\n- Synopsis: generate a portable standalone HTML artifact from a rendered page for offline sharing.\n- Flags: `--output`, `--json`.\n- Inputs: page id. If omitted, the first available page is published.\n- Outputs: a single-file static HTML artifact at `iris/archive/<id>-publish.html` or the exact requested path. Missing parent directories are created.\n- Exit codes: 0/1/2.\n- Example: `iris publish bug-cache-stampede --output dist/published.html`.\n- Surfaces: CLI + local publish/export flows.\n\nPublished HTML includes the page CSS and has no local-file or network asset dependency. Interactive features that require the project script, and navigation links that point into the `iris/` tree, are intentionally omitted from this static handoff artifact.\n\n## `iris promote <report-id> <feature|bug|idea>`\n\n- Synopsis: remap report sections into promoted page and link both.\n- Flags: `--json`.\n- Inputs: report id + target type.\n- Outputs: new promoted page folder.\n- Exit codes: 0/1/2.\n- Example: `iris promote report-cache feature`.\n- Surfaces: CLI + skills.\n- Status: not yet implemented; the CLI exits 1 with a clear message until a later milestone lands.\n\n## `iris sync`\n\n- Synopsis: incremental changelog, hotspots, stale marks, selective re-render.\n- Flags: `--json`.\n- Inputs: local page contracts, adopted source paths, and the hashes stored in `iris/state.json`.\n- Outputs: state updates + feed/delta artifacts.\n- Exit codes: 0/1/2.\n- Example: `iris sync`.\n- Surfaces: CLI + hooks.\n- State transitions: `refreshed` for changed page data or missing output, `stale` for changed/removed adopted sources, and `unchanged` when no work is needed.\n\n## `iris adopt`\n\n- Synopsis: mirror README/docs markdown as read-only styled pages.\n- Flags: `--json`.\n- Inputs: repo docs markdown.\n- Outputs: mirror pages + dashboard listing.\n- Exit codes: 0/1/2.\n- Example: `iris adopt`.\n- Surfaces: CLI + skills.\n- Contract: scans `README.md` and `docs/**/*.md`, stores the source path and content hash in the page registry, and writes a read-only report mirror. Re-run `adopt` to accept a source update flagged by `sync`.\n\n## `iris archive <id>`\n\n- Synopsis: move page to archive and update feed/index.\n- Flags: `--json`.\n- Inputs: page id.\n- Outputs: archived page + state update.\n- Exit codes: 0/1/2.\n- Example: `iris archive bug-cache-stampede`.\n- Surfaces: CLI + skills.\n\n## `iris export <id> --single|--png|--pdf`\n\n- Synopsis: export standalone HTML or rendered image/PDF.\n- Flags: `--single` (default), `--png`, `--pdf`, `--output`, `--json`.\n- Inputs: page id.\n- Outputs: `--single` writes `iris/archive/<id>.html`; an explicit `--output` path overrides that location and missing parent directories are created.\n- Exit codes: 0/1/2.\n- Example: `iris export bug-cache-stampede --single`.\n- Surfaces: CLI + skills.\n\nCurrent limitation: the standalone HTML exporter is implemented, but PNG and PDF remain unavailable until the project approves and integrates a browser renderer. Requests for either mode fail explicitly; they never emit mislabeled HTML. The bundled CSS uses system font stacks, so no remote font files are required.\n\n## `iris vendor`\n\n- Synopsis: download pinned CDN assets into `design/vendor` and switch asset base.\n- Flags: `--json`.\n- Inputs: CDN constants.\n- Outputs: local vendored assets.\n- Exit codes: 0/1/2.\n- Example: `iris vendor`.\n- Surfaces: CLI + skills.\n- Status: not yet implemented; the CLI exits 1 with a clear message until a later milestone lands.\n\n## `iris open`\n\n- Synopsis: open `iris/index.html` in the default browser via the platform opener (`open`, `start`, or `xdg-open`).\n- Flags: `--json`.\n- Inputs: local dashboard path.\n- Outputs: browser launch; prints the opened path.\n- Exit codes: 0 opened · 1 when `iris/index.html` is missing (run `iris init` first) · 2 when the opener cannot launch.\n- Example: `iris open`.\n- Surfaces: CLI + editor task.\n\n## `iris update`\n\n- Synopsis: regenerate managed integration shims while preserving user edits outside managed blocks.\n- Flags: `--json`.\n- Inputs: existing project configuration.\n- Outputs: refreshed surface shim files.\n- Exit codes: 0/1/2.\n- Example: `iris update`.\n- Surfaces: CLI.\n- Managed boundary: design assets and the `iris: open dashboard` task are refreshed; unrelated `.vscode/tasks.json` entries are preserved.\n"
    },
    "promotable_as": []
  }
}
